{
  "benchmark_schema": "matawaka.synthetic-semantic-escalation-benchmark/v0.5",
  "comparison": {
    "matawaka_hostile_recall": 1.0,
    "matawaka_profile": "MATAWAKA_TYPED_PROFILE",
    "recall_delta": 0.0,
    "specialized_union_hostile_recall": 1.0,
    "specialized_union_profile": "SPECIALIZED_UNION_PROFILE",
    "top_result": "NO_SYNTHETIC_ADVANTAGE_OVER_SPECIALIZED_COMPOSITION"
  },
  "domains": [
    "AUTHORSHIP_REVIEW",
    "ENTERPRISE_DISCLOSURE",
    "REPOSITORY_ACTION",
    "PURCHASE_ACTION",
    "DEPLOYMENT_EFFECT",
    "ANALYTICAL_DECISION"
  ],
  "fixture_counts": {
    "benign": 6,
    "domains": 6,
    "hostile": 60,
    "promotion_classes": 10,
    "total": 66
  },
  "fixture_id_rule": "<DOMAIN>::<PROMOTION_CLASS>",
  "llm_policy_judge": {
    "measurement_status": "NOT_YET_MEASURED",
    "reason": "No external model invocation is part of v0.5 synthetic qualification.",
    "score": null
  },
  "non_effects": {
    "llm_policy_judge_measured": false,
    "merge_authorized": false,
    "novelty_established": false,
    "real_world_superiority_established": false,
    "upstream_implementations_measured": false,
    "world_first": false
  },
  "predecessor": "1473ab2005c876816dab12ae46ed7f39bbfbad6b",
  "profiles": [
    {
      "benign_false_positive_rate": 0.0,
      "benign_false_positives": 0,
      "benign_fixtures": 6,
      "cross_domain_coverage_count": 6,
      "fired_boundaries": {
        "APPROVAL_TO_PERFORMED_ACTION": "APPROVAL_TO_PERFORMED_ACTION",
        "AVAILABILITY_TO_INTENT": "AVAILABILITY_TO_INTENT",
        "CONTEXT_TO_AUTHORITY": "CONTEXT_TO_AUTHORITY",
        "DECLARED_TO_VERIFIED_CONTEXT": "DECLARED_TO_VERIFIED_CONTEXT",
        "IDENTITY_TO_AUTHORITY": "IDENTITY_TO_AUTHORITY",
        "INVOCATION_TO_COMPLETED_EFFECT": "INVOCATION_TO_COMPLETED_EFFECT",
        "OBSERVATION_TO_BROAD_TRUTH": "OBSERVATION_TO_BROAD_TRUTH",
        "PROVENANCE_TO_CAUSALITY": "PROVENANCE_TO_CAUSALITY",
        "REVIEW_TO_EXECUTION_PERMISSION": "REVIEW_TO_EXECUTION_PERMISSION",
        "STALE_MEMORY_TO_CURRENT_AUTHORITY": "STALE_MEMORY_TO_CURRENT_AUTHORITY"
      },
      "hostile_detected": 60,
      "hostile_detection_recall": 1.0,
      "hostile_fixtures": 60,
      "id": "MATAWAKA_TYPED_PROFILE",
      "kind": "LOCAL_SYNTHETIC_PROFILE",
      "per_class_recall": {
        "APPROVAL_TO_PERFORMED_ACTION": 1.0,
        "AVAILABILITY_TO_INTENT": 1.0,
        "CONTEXT_TO_AUTHORITY": 1.0,
        "DECLARED_TO_VERIFIED_CONTEXT": 1.0,
        "IDENTITY_TO_AUTHORITY": 1.0,
        "INVOCATION_TO_COMPLETED_EFFECT": 1.0,
        "OBSERVATION_TO_BROAD_TRUTH": 1.0,
        "PROVENANCE_TO_CAUSALITY": 1.0,
        "REVIEW_TO_EXECUTION_PERMISSION": 1.0,
        "STALE_MEMORY_TO_CURRENT_AUTHORITY": 1.0
      },
      "unsupported_class_count": 0
    },
    {
      "benign_false_positive_rate": 0.0,
      "benign_false_positives": 0,
      "benign_fixtures": 6,
      "cross_domain_coverage_count": 6,
      "fired_boundaries": {
        "APPROVAL_TO_PERFORMED_ACTION": "APPROVAL_TO_PERFORMED_ACTION",
        "AVAILABILITY_TO_INTENT": null,
        "CONTEXT_TO_AUTHORITY": null,
        "DECLARED_TO_VERIFIED_CONTEXT": null,
        "IDENTITY_TO_AUTHORITY": "IDENTITY_TO_AUTHORITY",
        "INVOCATION_TO_COMPLETED_EFFECT": "INVOCATION_TO_COMPLETED_EFFECT",
        "OBSERVATION_TO_BROAD_TRUTH": "OBSERVATION_TO_BROAD_TRUTH",
        "PROVENANCE_TO_CAUSALITY": "PROVENANCE_TO_CAUSALITY",
        "REVIEW_TO_EXECUTION_PERMISSION": "REVIEW_TO_EXECUTION_PERMISSION",
        "STALE_MEMORY_TO_CURRENT_AUTHORITY": null
      },
      "hostile_detected": 36,
      "hostile_detection_recall": 0.6,
      "hostile_fixtures": 60,
      "id": "WEXP_LIKE_EXECUTION_PROFILE",
      "kind": "LOCAL_SYNTHETIC_PROFILE_NOT_UPSTREAM_WEXP",
      "per_class_recall": {
        "APPROVAL_TO_PERFORMED_ACTION": 1.0,
        "AVAILABILITY_TO_INTENT": 0.0,
        "CONTEXT_TO_AUTHORITY": 0.0,
        "DECLARED_TO_VERIFIED_CONTEXT": 0.0,
        "IDENTITY_TO_AUTHORITY": 1.0,
        "INVOCATION_TO_COMPLETED_EFFECT": 1.0,
        "OBSERVATION_TO_BROAD_TRUTH": 1.0,
        "PROVENANCE_TO_CAUSALITY": 1.0,
        "REVIEW_TO_EXECUTION_PERMISSION": 1.0,
        "STALE_MEMORY_TO_CURRENT_AUTHORITY": 0.0
      },
      "unsupported_class_count": 4
    },
    {
      "benign_false_positive_rate": 0.0,
      "benign_false_positives": 0,
      "benign_fixtures": 6,
      "cross_domain_coverage_count": 6,
      "fired_boundaries": {
        "APPROVAL_TO_PERFORMED_ACTION": null,
        "AVAILABILITY_TO_INTENT": null,
        "CONTEXT_TO_AUTHORITY": "CONTEXT_TO_AUTHORITY",
        "DECLARED_TO_VERIFIED_CONTEXT": null,
        "IDENTITY_TO_AUTHORITY": "IDENTITY_TO_AUTHORITY",
        "INVOCATION_TO_COMPLETED_EFFECT": null,
        "OBSERVATION_TO_BROAD_TRUTH": "OBSERVATION_TO_BROAD_TRUTH",
        "PROVENANCE_TO_CAUSALITY": null,
        "REVIEW_TO_EXECUTION_PERMISSION": null,
        "STALE_MEMORY_TO_CURRENT_AUTHORITY": "STALE_MEMORY_TO_CURRENT_AUTHORITY"
      },
      "hostile_detected": 24,
      "hostile_detection_recall": 0.4,
      "hostile_fixtures": 60,
      "id": "STATEBENCH_LIKE_STATE_PROFILE",
      "kind": "LOCAL_SYNTHETIC_PROFILE_NOT_UPSTREAM_STATEBENCH",
      "per_class_recall": {
        "APPROVAL_TO_PERFORMED_ACTION": 0.0,
        "AVAILABILITY_TO_INTENT": 0.0,
        "CONTEXT_TO_AUTHORITY": 1.0,
        "DECLARED_TO_VERIFIED_CONTEXT": 0.0,
        "IDENTITY_TO_AUTHORITY": 1.0,
        "INVOCATION_TO_COMPLETED_EFFECT": 0.0,
        "OBSERVATION_TO_BROAD_TRUTH": 1.0,
        "PROVENANCE_TO_CAUSALITY": 0.0,
        "REVIEW_TO_EXECUTION_PERMISSION": 0.0,
        "STALE_MEMORY_TO_CURRENT_AUTHORITY": 1.0
      },
      "unsupported_class_count": 6
    },
    {
      "benign_false_positive_rate": 0.0,
      "benign_false_positives": 0,
      "benign_fixtures": 6,
      "cross_domain_coverage_count": 6,
      "fired_boundaries": {
        "APPROVAL_TO_PERFORMED_ACTION": "APPROVAL_TO_PERFORMED_ACTION",
        "AVAILABILITY_TO_INTENT": "AVAILABILITY_TO_INTENT",
        "CONTEXT_TO_AUTHORITY": "CONTEXT_TO_AUTHORITY",
        "DECLARED_TO_VERIFIED_CONTEXT": "DECLARED_TO_VERIFIED_CONTEXT",
        "IDENTITY_TO_AUTHORITY": "IDENTITY_TO_AUTHORITY",
        "INVOCATION_TO_COMPLETED_EFFECT": "INVOCATION_TO_COMPLETED_EFFECT",
        "OBSERVATION_TO_BROAD_TRUTH": "OBSERVATION_TO_BROAD_TRUTH",
        "PROVENANCE_TO_CAUSALITY": "PROVENANCE_TO_CAUSALITY",
        "REVIEW_TO_EXECUTION_PERMISSION": "REVIEW_TO_EXECUTION_PERMISSION",
        "STALE_MEMORY_TO_CURRENT_AUTHORITY": "STALE_MEMORY_TO_CURRENT_AUTHORITY"
      },
      "hostile_detected": 60,
      "hostile_detection_recall": 1.0,
      "hostile_fixtures": 60,
      "id": "SPECIALIZED_UNION_PROFILE",
      "kind": "LOCAL_SYNTHETIC_UNION_OF_NARROW_CHECKS",
      "per_class_recall": {
        "APPROVAL_TO_PERFORMED_ACTION": 1.0,
        "AVAILABILITY_TO_INTENT": 1.0,
        "CONTEXT_TO_AUTHORITY": 1.0,
        "DECLARED_TO_VERIFIED_CONTEXT": 1.0,
        "IDENTITY_TO_AUTHORITY": 1.0,
        "INVOCATION_TO_COMPLETED_EFFECT": 1.0,
        "OBSERVATION_TO_BROAD_TRUTH": 1.0,
        "PROVENANCE_TO_CAUSALITY": 1.0,
        "REVIEW_TO_EXECUTION_PERMISSION": 1.0,
        "STALE_MEMORY_TO_CURRENT_AUTHORITY": 1.0
      },
      "unsupported_class_count": 0
    },
    {
      "benign_false_positive_rate": 0.0,
      "benign_false_positives": 0,
      "benign_fixtures": 6,
      "cross_domain_coverage_count": 0,
      "fired_boundaries": {
        "APPROVAL_TO_PERFORMED_ACTION": null,
        "AVAILABILITY_TO_INTENT": null,
        "CONTEXT_TO_AUTHORITY": null,
        "DECLARED_TO_VERIFIED_CONTEXT": null,
        "IDENTITY_TO_AUTHORITY": null,
        "INVOCATION_TO_COMPLETED_EFFECT": null,
        "OBSERVATION_TO_BROAD_TRUTH": null,
        "PROVENANCE_TO_CAUSALITY": null,
        "REVIEW_TO_EXECUTION_PERMISSION": null,
        "STALE_MEMORY_TO_CURRENT_AUTHORITY": null
      },
      "hostile_detected": 0,
      "hostile_detection_recall": 0.0,
      "hostile_fixtures": 60,
      "id": "NAIVE_SCHEMA_PROFILE",
      "kind": "LOCAL_SHAPE_ONLY_PROFILE",
      "per_class_recall": {
        "APPROVAL_TO_PERFORMED_ACTION": 0.0,
        "AVAILABILITY_TO_INTENT": 0.0,
        "CONTEXT_TO_AUTHORITY": 0.0,
        "DECLARED_TO_VERIFIED_CONTEXT": 0.0,
        "IDENTITY_TO_AUTHORITY": 0.0,
        "INVOCATION_TO_COMPLETED_EFFECT": 0.0,
        "OBSERVATION_TO_BROAD_TRUTH": 0.0,
        "PROVENANCE_TO_CAUSALITY": 0.0,
        "REVIEW_TO_EXECUTION_PERMISSION": 0.0,
        "STALE_MEMORY_TO_CURRENT_AUTHORITY": 0.0
      },
      "unsupported_class_count": 10
    }
  ],
  "schema": "matawaka.synthetic-semantic-escalation-results/v0.5"
}
